{"source":"contract fixture","builder_version":"0","fingerprint":"0","built_at":"2026-10-26T12:00:00Z","items_total":2,"items_with_drop_records":0,"items_with_usage":0,"recipes":0,"trader_offers":0,"building_costs":0,"stations":0,"traders":0,"categories":{"resource":1,"food":1},"rarities":{"Common":2},"stat_values":false,"stat_values_from":"","not_in_game_data":[]}